"Industry Title","Industry Code","Industry Type","2021 Employment","2021 Percent of Occupation","2021 Percent of Industry","Projected 2031 Employment","Projected 2031 Percent of Occupation","Projected 2031 Percent of Industry","Employment Change, 2021-2031","Employment Percent Change, 2021-2031","Industry Sort","Display Level"
"Deep sea, coastal, and great lakes water transportation","=""483100""","Line Item","32.0","0.0","100.0","33.7","0.0","100.0","1.7","5.3","203","4"
"Inland water transportation","=""483200""","Line Item","24.4","0.0","100.0","25.5","0.0","100.0","1.1","4.3","204","4"
"Truck transportation","=""484000""","Line Item","1,514.2","1.0","100.0","1,538.6","0.9","100.0","24.4","1.6","205","3"
"Transit and ground passenger transportation","=""485000""","Summary","374.6","0.2","100.0","418.5","0.3","100.0","43.9","11.7","206","3"
"Urban transit systems","=""485100""","Line Item","47.0","0.0","100.0","50.2","0.0","100.0","3.2","6.8","207","4"
"Interurban and rural bus transportation","=""485200""","Line Item","15.3","0.0","100.0","16.7","0.0","100.0","1.4","9.1","208","4"
"Taxi and limousine service","=""485300""","Line Item","43.1","0.0","100.0","47.1","0.0","100.0","4.0","9.2","209","4"
"School and employee bus transportation","=""485400""","Line Item","160.4","0.1","100.0","178.9","0.1","100.0","18.5","11.5","210","4"
"Charter bus industry","=""485500""","Line Item","18.6","0.0","100.0","22.0","0.0","100.0","3.3","17.9","211","4"
"Other transit and ground passenger transportation","=""485900""","Line Item","90.1","0.1","100.0","103.6","0.1","100.0","13.5","15.0","212","4"
"Pipeline transportation","=""486000""","Summary","49.9","0.0","100.0","53.1","0.0","100.0","3.2","6.5","213","3"
"Pipeline transportation of crude oil","=""486100""","Line Item","11.5","0.0","100.0","13.1","0.0","100.0","1.6","14.3","214","4"
"Pipeline transportation of natural gas","=""486200""","Line Item","30.2","0.0","100.0","31.0","0.0","100.0","0.8","2.6","215","4"
"Other pipeline transportation","=""486900""","Line Item","8.2","0.0","100.0","9.0","0.0","100.0","0.8","9.6","216","4"
"Scenic and sightseeing transportation and support activities for transportation","=""487-80""","Summary","744.9","0.5","100.0","780.8","0.5","100.0","35.9","4.8","217","3"
"Scenic and sightseeing transportation","=""487000""","Summary","22.6","0.0","100.0","30.1","0.0","100.0","7.5","33.0","218","4"
"Scenic and sightseeing transportation, land","=""487100""","Line Item","7.6","0.0","100.0","12.5","0.0","100.0","4.9","65.1","219","5"
"Scenic and sightseeing transportation, water","=""487200""","Line Item","12.9","0.0","100.0","14.8","0.0","100.0","1.9","14.9","220","5"
"Scenic and sightseeing transportation, other","=""487900""","Line Item","2.1","0.0","100.0","2.7","0.0","100.0","0.6","28.7","221","5"
"Support activities for transportation","=""488000""","Summary","722.3","0.5","100.0","750.8","0.5","100.0","28.5","3.9","222","4"
"Support activities for air transportation","=""488100""","Line Item","203.2","0.1","100.0","226.4","0.1","100.0","23.2","11.4","223","5"
"Support activities for rail transportation","=""488200""","Line Item","37.7","0.0","100.0","35.9","0.0","100.0","-1.8","-4.8","224","5"
"Support activities for water transportation","=""488300""","Line Item","90.0","0.1","100.0","76.5","0.0","100.0","-13.5","-15.0","225","5"
"Support activities for road transportation","=""488400""","Line Item","110.1","0.1","100.0","111.3","0.1","100.0","1.2","1.1","226","5"
"Freight transportation arrangement","=""488500""","Line Item","242.2","0.2","100.0","259.6","0.2","100.0","17.4","7.2","227","5"
"Other support activities for transportation","=""488900""","Line Item","39.1","0.0","100.0","41.0","0.0","100.0","1.9","4.9","228","5"
"Couriers and messengers","=""492000""","Summary","1,082.2","0.7","100.0","1,253.0","0.8","100.0","170.8","15.8","229","3"
"Couriers and express delivery services","=""492100""","Line Item","902.4","0.6","100.0","1,042.5","0.6","100.0","140.1","15.5","230","4"
"Local messengers and local delivery","=""492200""","Line Item","179.8","0.1","100.0","210.5","0.1","100.0","30.7","17.1","231","4"
"Warehousing and storage","=""493000""","Line Item","1,648.2","1.0","100.0","1,789.2","1.1","100.0","141.0","8.6","232","3"
"Information","=""510000""","Summary","2,831.3","1.8","100.0","3,041.2","1.8","100.0","209.9","7.4","233","2"
"Publishing industries (except Internet)","=""511000""","Summary","790.8","0.5","100.0","773.8","0.5","100.0","-17.0","-2.1","234","3"
"Newspaper, periodical, book, and directory publishers","=""511100""","Summary","247.3","0.2","100.0","187.4","0.1","100.0","-59.9","-24.2","235","4"
"Newspaper publishers","=""511110""","Line Item","103.7","0.1","100.0","72.2","0.0","100.0","-31.5","-30.4","236","5"
"Software publishers","=""511200""","Line Item","543.5","0.3","100.0","586.4","0.4","100.0","42.9","7.9","238","4"
"Motion picture and sound recording industries","=""512000""","Summary","370.8","0.2","100.0","446.1","0.3","100.0","75.3","20.3","239","3"
"Motion picture and video industries","=""512100""","Summary","350.4","0.2","100.0","424.6","0.3","100.0","74.2","21.2","240","4"
"Motion picture and video exhibition","=""512130""","Line Item","67.9","0.0","100.0","115.8","0.1","100.0","47.9","70.5","241","5"
"Sound recording industries","=""512200""","Line Item","20.4","0.0","100.0","21.4","0.0","100.0","1.0","5.0","243","4"
"Broadcasting (except Internet)","=""515000""","Summary","236.3","0.1","100.0","211.5","0.1","100.0","-24.8","-10.5","244","3"
"Radio and television broadcasting","=""515100""","Summary","190.5","0.1","100.0","175.4","0.1","100.0","-15.1","-7.9","245","4"
"Radio broadcasting","=""515110""","Line Item","67.1","0.0","100.0","58.8","0.0","100.0","-8.3","-12.4","246","5"
"Television broadcasting","=""515120""","Line Item","123.4","0.1","100.0","116.7","0.1","100.0","-6.7","-5.5","247","5"
"Cable and other subscription programming","=""515200""","Line Item","45.8","0.0","100.0","36.1","0.0","100.0","-9.7","-21.2","248","4"
"Telecommunications","=""517000""","Line Item","666.8","0.4","100.0","662.6","0.4","100.0","-4.2","-0.6","249","3"
"Data processing, hosting, and related services","=""518000""","Line Item","388.3","0.2","100.0","456.1","0.3","100.0","67.8","17.5","250","3"
"Other information services","=""519000""","Line Item","378.3","0.2","100.0","491.2","0.3","100.0","112.9","29.8","251","3"
"Finance and insurance","=""520000""","Summary","6,519.6","4.1","100.0","6,806.9","4.1","100.0","287.3","4.4","252","2"
"Monetary authorities, credit intermediation, and related activities","=""521-20""","Summary","2,727.8","1.7","100.0","2,806.6","1.7","100.0","78.8","2.9","253","3"
"Monetary authorities-central bank","=""521000""","Line Item","20.9","0.0","100.0","21.6","0.0","100.0","0.7","3.4","254","4"
"Credit intermediation and related activities","=""522000""","Summary","2,706.9","1.7","100.0","2,785.0","1.7","100.0","78.1","2.9","255","4"
"Nondepository credit intermediation","=""522200""","Summary","633.8","0.4","100.0","651.7","0.4","100.0","17.9","2.8","256","5"
"Other nondepository credit intermediation","=""522290""","Line Item","473.6","0.3","100.0","485.8","0.3","100.0","12.2","2.6","257","6"
"Credit intermediation and related activities (5221,3)","=""5220A1""","Line Item","2,073.1","1.3","100.0","2,133.3","1.3","100.0","60.2","2.9","259","5"
"Insurance carriers and related activities","=""524000""","Summary","2,801.8","1.8","100.0","2,876.8","1.7","100.0","75.0","2.7","260","3"
"Insurance carriers","=""524100""","Summary","1,566.9","1.0","100.0","1,588.8","1.0","100.0","21.9","1.4","261","4"
"Direct health and medical insurance carriers","=""524114""","Line Item","571.4","0.4","100.0","592.9","0.4","100.0","21.6","3.8","262","5"
"Direct insurance (except life, health, and medical) carriers","=""524120""","Line Item","628.6","0.4","100.0","628.8","0.4","100.0","0.2","0.0","263","5"
"Agencies, brokerages, and other insurance related activities","=""524200""","Summary","1,234.9","0.8","100.0","1,288.0","0.8","100.0","53.1","4.3","265","4"
"Insurance agencies and brokerages","=""524210""","Line Item","881.6","0.6","100.0","914.9","0.5","100.0","33.3","3.8","266","5"
"Other insurance related activities","=""524290""","Line Item","353.3","0.2","100.0","373.1","0.2","100.0","19.8","5.6","267","5"
"Securities, commodity contracts, fund, trusts and other financial investments and vehicles and related activities","=""523,50""","Summary","990.0","0.6","100.0","1,123.5","0.7","100.0","133.5","13.5","268","3"
"Securities, commodity contracts, and other financial investments and related activities","=""523000""","Line Item","969.2","0.6","100.0","1,093.2","0.7","100.0","124.0","12.8","269","4"
"Funds, trusts, and other financial vehicles","=""525000""","Summary","20.8","0.0","100.0","30.3","0.0","100.0","9.5","45.7","270","4"
"Insurance and employee benefit funds","=""525100""","Line Item","8.3","0.0","100.0","13.5","0.0","100.0","5.2","61.9","271","5"
"Other investment pools and funds","=""525900""","Line Item","12.5","0.0","100.0","16.9","0.0","100.0","4.4","35.0","272","5"
"Real estate and rental and leasing","=""530000""","Summary","2,257.4","1.4","100.0","2,306.2","1.4","100.0","48.8","2.2","273","2"
"Real estate","=""531000""","Line Item","1,747.2","1.1","100.0","1,784.2","1.1","100.0","37.0","2.1","274","3"
"Rental and leasing services","=""532000""","Summary","489.7","0.3","100.0","501.8","0.3","100.0","12.1","2.5","275","3"
"Automotive equipment rental and leasing","=""532100""","Line Item","189.0","0.1","100.0","203.1","0.1","100.0","14.1","7.5","276","4"
"Rental and leasing services (5322,3,4)","=""5320A1""","Line Item","300.7","0.2","100.0","298.7","0.2","100.0","-2.0","-0.7","277","4"
"Lessors of nonfinancial intangible assets (except copyrighted works)","=""533000""","Line Item","20.5","0.0","100.0","20.2","0.0","100.0","-0.3","-1.3","278","3"
"Professional, scientific, and technical services","=""540000""","Summary","9,882.8","6.2","100.0","10,957.5","6.6","100.0","1,074.7","10.9","279","2"
"Professional, scientific, and technical services","=""541000""","Summary","9,882.8","6.2","100.0","10,957.5","6.6","100.0","1,074.7","10.9","280","3"
"Legal services","=""541100""","Line Item","1,154.8","0.7","100.0","1,227.9","0.7","100.0","73.1","6.3","281","4"
"Accounting, tax preparation, bookkeeping, and payroll services","=""541200""","Line Item","1,048.9","0.7","100.0","1,062.5","0.6","100.0","13.6","1.3","282","4"
"Architectural, engineering, and related services","=""541300""","Summary","1,545.1","1.0","100.0","1,573.7","0.9","100.0","28.6","1.9","283","4"
"Engineering services","=""541330""","Line Item","1,040.7","0.7","100.0","1,059.3","0.6","100.0","18.6","1.8","285","5"
"Testing laboratories","=""541380""","Line Item","177.2","0.1","100.0","179.6","0.1","100.0","2.4","1.3","287","5"
"Specialized design services","=""541400""","Line Item","141.4","0.1","100.0","148.4","0.1","100.0","7.0","4.9","288","4"
"Computer systems design and related services","=""541500""","Line Item","2,301.3","1.5","100.0","2,756.5","1.7","100.0","455.2","19.8","289","4"
"Management, scientific, and technical consulting services","=""541600""","Line Item","1,634.3","1.0","100.0","1,854.4","1.1","100.0","220.1","13.5","290","4"
"Scientific research and development services","=""541700""","Summary","823.2","0.5","100.0","923.8","0.6","100.0","100.6","12.2","291","4"
"Research and development in the physical, engineering, and life sciences","=""541710""","Line Item","762.1","0.5","100.0","859.2","0.5","100.0","97.1","12.7","292","5"
"Research and development in the social sciences and humanities","=""541720""","Line Item","61.1","0.0","100.0","64.7","0.0","100.0","3.6","5.8","293","5"
"Advertising, public relations, and related services","=""541800""","Line Item","445.7","0.3","100.0","478.1","0.3","100.0","32.4","7.3","294","4"
"Other professional, scientific, and technical services","=""541900""","Summary","788.1","0.5","100.0","932.2","0.6","100.0","144.1","18.3","295","4"
"Photographic services","=""541920""","Line Item","39.0","0.0","100.0","28.0","0.0","100.0","-11.0","-28.3","296","5"
"Veterinary services","=""541940""","Line Item","438.5","0.3","100.0","512.7","0.3","100.0","74.2","16.9","297","5"
"Management of companies and enterprises","=""550000""","Summary","2,337.5","1.5","100.0","2,405.7","1.4","100.0","68.2","2.9","299","2"
"Management of companies and enterprises","=""551000""","Line Item","2,337.5","1.5","100.0","2,405.7","1.4","100.0","68.2","2.9","300","3"
"Administrative and support and waste management and remediation services","=""560000""","Summary","9,029.4","5.7","100.0","9,435.7","5.7","100.0","406.3","4.5","301","2"
"Administrative and support services","=""561000""","Summary","8,573.0","5.4","100.0","8,954.5","5.4","100.0","381.5","4.5","302","3"
"Office administrative services","=""561100""","Line Item","545.1","0.3","100.0","631.5","0.4","100.0","86.4","15.8","303","4"
"Facilities support services","=""561200""","Line Item","155.5","0.1","100.0","161.4","0.1","100.0","5.9","3.8","304","4"
"Employment services","=""561300""","Summary","3,562.9","2.3","100.0","3,658.6","2.2","100.0","95.7","2.7","305","4"
"Temporary help services","=""561320""","Line Item","2,903.2","1.8","100.0","2,965.3","1.8","100.0","62.1","2.1","306","5"
"Business support services","=""561400""","Line Item","810.1","0.5","100.0","827.0","0.5","100.0","16.9","2.1","308","4"
"Travel arrangement and reservation services","=""561500""","Line Item","138.1","0.1","100.0","170.4","0.1","100.0","32.3","23.4","309","4"
"Investigation and security services","=""561600""","Summary","910.8","0.6","100.0","972.3","0.6","100.0","61.5","6.8","310","4"
"Investigation, guard, and armored car services","=""561610""","Line Item","759.2","0.5","100.0","809.9","0.5","100.0","50.7","6.7","311","5"
"Security systems services","=""561620""","Line Item","151.6","0.1","100.0","162.4","0.1","100.0","10.8","7.1","312","5"
"Services to buildings and dwellings","=""561700""","Summary","2,152.7","1.4","100.0","2,190.2","1.3","100.0","37.5","1.7","313","4"
"Exterminating and pest control services","=""561710""","Line Item","139.4","0.1","100.0","145.6","0.1","100.0","6.2","4.5","314","5"
"Landscaping services","=""561730""","Line Item","841.0","0.5","100.0","864.0","0.5","100.0","23.0","2.7","315","5"
"Other support services","=""561900""","Line Item","297.8","0.2","100.0","343.2","0.2","100.0","45.4","15.2","317","4"
"Waste management and remediation services","=""562000""","Summary","456.4","0.3","100.0","481.1","0.3","100.0","24.7","5.4","318","3"
"Waste collection","=""562100""","Line Item","196.8","0.1","100.0","207.6","0.1","100.0","10.8","5.5","319","4"
"Waste treatment and disposal","=""562200""","Line Item","98.8","0.1","100.0","102.5","0.1","100.0","3.7","3.7","320","4"
"Remediation and other waste management services","=""562900""","Line Item","160.8","0.1","100.0","171.1","0.1","100.0","10.3","6.4","321","4"
"Educational services; state, local, and private","=""610000""","Summary","13,709.2","8.7","100.0","14,501.2","8.7","100.0","792.0","5.8","322","2"
"Educational services; state, local, and private","=""611000""","Summary","13,709.2","8.7","100.0","14,501.2","8.7","100.0","792.0","5.8","323","3"
"Elementary and secondary schools; state, local, and private","=""611100""","Summary","8,236.0","5.2","100.0","8,511.1","5.1","100.0","275.1","3.3","324","4"
"Elementary and secondary schools; private","=""611105""","Line Item","1,073.2","0.7","100.0","1,202.8","0.7","100.0","129.6","12.1","325","5"
"Elementary and secondary schools; state","=""611102""","Line Item","74.3","0.0","100.0","84.8","0.1","100.0","10.5","14.1","326","5"
"Elementary and secondary schools; local","=""611103""","Line Item","7,088.4","4.5","100.0","7,223.4","4.3","100.0","135.0","1.9","327","5"
"Junior colleges, colleges, universities, and professional schools; state, local, and private","=""6112-3""","Summary","4,646.5","2.9","100.0","4,977.2","3.0","100.0","330.7","7.1","328","4"
"Junior colleges; state, local, and private","=""611200""","Summary","691.1","0.4","100.0","675.0","0.4","100.0","-16.1","-2.3","329","5"
"Junior colleges; private","=""611205""","Line Item","47.5","0.0","100.0","25.6","0.0","100.0","-21.9","-46.2","330","6"
"Junior colleges; state","=""611202""","Line Item","262.2","0.2","100.0","272.3","0.2","100.0","10.2","3.9","331","6"
"Junior colleges; local","=""611203""","Line Item","381.4","0.2","100.0","377.1","0.2","100.0","-4.3","-1.1","332","6"
"Colleges, universities, and professional schools; state, local, and private","=""611300""","Summary","3,955.4","2.5","100.0","4,302.2","2.6","100.0","346.8","8.8","333","5"
"Colleges, universities, and professional schools; private","=""611305""","Line Item","1,708.7","1.1","100.0","1,868.9","1.1","100.0","160.2","9.4","334","6"
"Colleges, universities, and professional schools; state","=""611302""","Line Item","2,179.2","1.4","100.0","2,351.6","1.4","100.0","172.3","7.9","335","6"
"Colleges, universities, and professional schools; local","=""611303""","Line Item","67.5","0.0","100.0","81.7","0.0","100.0","14.2","21.1","336","6"
"Other educational services; state, local, and private","=""6114-7""","Summary","826.8","0.5","100.0","1,012.9","0.6","100.0","186.2","22.5","337","4"
"Business schools and computer and management training; state, local, and private","=""611400""","Summary","82.4","0.1","100.0","86.1","0.1","100.0","3.7","4.5","338","5"
"Business schools and computer and management training; private","=""611405""","Line Item","78.0","0.0","100.0","80.8","0.0","100.0","2.8","3.6","339","6"
"Business schools and computer and management training; state","=""611402""","Line Item","2.6","0.0","100.0","3.1","0.0","100.0","0.5","20.4","340","6"
"Business schools and computer and management training; local","=""611403""","Line Item","1.8","0.0","100.0","2.1","0.0","100.0","0.3","19.2","341","6"
"Technical and trade schools; state, local, and private","=""611500""","Summary","132.6","0.1","100.0","140.5","0.1","100.0","7.9","5.9","342","5"
"Technical and trade schools; private","=""611505""","Line Item","108.9","0.1","100.0","112.2","0.1","100.0","3.3","3.1","343","6"
"Technical and trade schools; state","=""611502""","Line Item","13.9","0.0","100.0","16.8","0.0","100.0","2.8","20.2","344","6"
"Technical and trade schools; local","=""611503""","Line Item","9.8","0.0","100.0","11.5","0.0","100.0","1.7","17.5","345","6"
"Other schools and instruction; state, local, and private","=""611600""","Summary","413.5","0.3","100.0","554.6","0.3","100.0","141.1","34.1","346","5"
"Other schools and instruction; private","=""611605""","Line Item","405.6","0.3","100.0","544.7","0.3","100.0","139.1","34.3","347","6"
"Other schools and instruction; state","=""611602""","Line Item","1.4","0.0","100.0","1.6","0.0","100.0","0.2","12.2","348","6"
"Other schools and instruction; local","=""611603""","Line Item","6.5","0.0","100.0","8.4","0.0","100.0","1.9","28.9","349","6"
"Educational support services; state, local, and private","=""611700""","Summary","198.2","0.1","100.0","231.7","0.1","100.0","33.5","16.9","350","5"
"Educational support services; private","=""611705""","Line Item","167.4","0.1","100.0","191.4","0.1","100.0","24.0","14.3","351","6"
"Educational support services; local","=""611703""","Line Item","30.6","0.0","100.0","39.8","0.0","100.0","9.2","29.9","353","6"
"Healthcare and social assistance","=""620000""","Summary","21,166.6","13.4","100.0","23,778.2","14.3","100.0","2,611.6","12.3","354","2"
"Ambulatory healthcare services","=""621000""","Summary","7,874.7","5.0","100.0","9,021.2","5.4","100.0","1,146.5","14.6","355","3"
"Offices of physicians","=""621100""","Line Item","2,739.1","1.7","100.0","3,012.5","1.8","100.0","273.4","10.0","356","4"
"Offices of dentists","=""621200""","Line Item","994.3","0.6","100.0","1,072.5","0.6","100.0","78.2","7.9","357","4"
"Offices of other health practitioners","=""621300""","Summary","1,012.5","0.6","100.0","1,217.9","0.7","100.0","205.4","20.3","358","4"
"Offices of chiropractors","=""621310""","Line Item","144.2","0.1","100.0","154.7","0.1","100.0","10.5","7.3","359","5"
"Offices of optometrists","=""621320""","Line Item","146.3","0.1","100.0","158.3","0.1","100.0","12.0","8.2","360","5"
"Offices of mental health practitioners (except physicians)","=""621330""","Line Item","144.7","0.1","100.0","170.5","0.1","100.0","25.8","17.8","361","5"
"Offices of physical, occupational and speech therapists, and audiologists","=""621340""","Line Item","419.4","0.3","100.0","545.6","0.3","100.0","126.2","30.1","362","5"
"Offices of all other health practitioners","=""621390""","Line Item","157.9","0.1","100.0","188.8","0.1","100.0","30.9","19.6","363","5"
"Outpatient care centers","=""621400""","Summary","996.6","0.6","100.0","1,177.8","0.7","100.0","181.2","18.2","364","4"
"Outpatient mental health and substance abuse centers","=""621420""","Line Item","262.7","0.2","100.0","309.8","0.2","100.0","47.1","17.9","365","5"
"Medical and diagnostic laboratories","=""621500""","Line Item","305.9","0.2","100.0","343.3","0.2","100.0","37.4","12.2","367","4"
"Home healthcare services","=""621600""","Line Item","1,514.3","1.0","100.0","1,844.4","1.1","100.0","330.1","21.8","368","4"
"Other ambulatory healthcare services","=""621900""","Summary","312.0","0.2","100.0","352.8","0.2","100.0","40.8","13.1","369","4"
"Ambulance services","=""621910""","Line Item","164.4","0.1","100.0","172.9","0.1","100.0","8.5","5.2","370","5"
"All other ambulatory healthcare services","=""621990""","Line Item","147.6","0.1","100.0","179.9","0.1","100.0","32.3","21.9","371","5"
"Hospitals; state, local, and private","=""622000""","Summary","6,208.7","3.9","100.0","6,533.1","3.9","100.0","324.4","5.2","372","3"
"General medical and surgical hospitals; state, local, and private","=""622100""","Summary","5,632.9","3.6","100.0","5,891.3","3.5","100.0","258.4","4.6","373","4"
"General medical and surgical hospitals; private","=""622105""","Line Item","4,703.4","3.0","100.0","4,951.9","3.0","100.0","248.5","5.3","374","5"
"General medical and surgical hospitals; state","=""622102""","Line Item","259.0","0.2","100.0","261.6","0.2","100.0","2.7","1.0","375","5"
"General medical and surgical hospitals; local","=""622103""","Line Item","670.6","0.4","100.0","677.8","0.4","100.0","7.2","1.1","376","5"
"Psychiatric and substance abuse hospitals; state, local, and private","=""622200""","Summary","267.3","0.2","100.0","290.0","0.2","100.0","22.7","8.5","377","4"
"Psychiatric and substance abuse hospitals; private","=""622205""","Line Item","149.9","0.1","100.0","181.4","0.1","100.0","31.5","21.0","378","5"
"Psychiatric and substance abuse hospitals; state","=""622202""","Line Item","114.2","0.1","100.0","105.6","0.1","100.0","-8.6","-7.6","379","5"
"Psychiatric and substance abuse hospitals; local","=""622203""","Line Item","3.2","0.0","100.0","2.9","0.0","100.0","-0.2","-7.5","380","5"
"Specialty (except psychiatric and substance abuse) hospitals; state, local, and private","=""622300""","Summary","308.5","0.2","100.0","351.8","0.2","100.0","43.3","14.0","381","4"
"Specialty (except psychiatric and substance abuse) hospitals; private","=""622305""","Line Item","272.7","0.2","100.0","315.5","0.2","100.0","42.8","15.7","382","5"
"Specialty (except psychiatric and substance abuse) hospitals; state","=""622302""","Line Item","35.0","0.0","100.0","35.6","0.0","100.0","0.5","1.5","383","5"
"Specialty (except psychiatric and substance abuse) hospitals; local","=""622303""","Line Item","0.8","0.0","100.0","0.7","0.0","100.0","-0.1","-8.8","384","5"
"Nursing and residential care facilities","=""623000""","Summary","3,022.8","1.9","100.0","3,158.7","1.9","100.0","135.9","4.5","385","3"
"Nursing care facilities (skilled nursing facilities)","=""623100""","Line Item","1,374.6","0.9","100.0","1,326.6","0.8","100.0","-48.0","-3.5","386","4"
"Residential intellectual and developmental disability, mental health, and substance abuse facilities","=""623200""","Summary","605.5","0.4","100.0","645.9","0.4","100.0","40.4","6.7","387","4"
"Residential intellectual and developmental disability facilities","=""623210""","Line Item","375.8","0.2","100.0","386.9","0.2","100.0","11.1","3.0","388","5"
"Residential mental health and substance abuse facilities","=""623220""","Line Item","229.7","0.1","100.0","259.0","0.2","100.0","29.3","12.8","389","5"
"Continuing care retirement communities and assisted living facilities for the elderly","=""623300""","Line Item","888.5","0.6","100.0","1,031.3","0.6","100.0","142.8","16.1","390","4"
"Other residential care facilities","=""623900""","Line Item","154.2","0.1","100.0","154.8","0.1","100.0","0.6","0.4","391","4"
"Social assistance","=""624000""","Summary","4,060.4","2.6","100.0","5,065.3","3.0","100.0","1,004.9","24.7","392","3"
"Individual and family services","=""624100""","Summary","2,708.4","1.7","100.0","3,558.4","2.1","100.0","850.0","31.4","393","4"
"Services for the elderly and persons with disabilities","=""624120""","Line Item","2,062.1","1.3","100.0","2,769.2","1.7","100.0","707.1","34.3","394","5"
"Community and vocational rehabilitation services","=""6242-3""","Summary","465.7","0.3","100.0","514.5","0.3","100.0","48.8","10.5","396","4"
"Community food and housing, and emergency and other relief services","=""624200""","Line Item","193.0","0.1","100.0","217.1","0.1","100.0","24.1","12.5","397","5"
"Vocational rehabilitation services","=""624300""","Line Item","272.7","0.2","100.0","297.4","0.2","100.0","24.7","9.1","398","5"
