"Industry Title","Industry Code","Industry Type","2021 Employment","2021 Percent of Occupation","2021 Percent of Industry","Projected 2031 Employment","Projected 2031 Percent of Occupation","Projected 2031 Percent of Industry","Employment Change, 2021-2031","Employment Percent Change, 2021-2031","Industry Sort","Display Level"
"Child day care services","=""624400""","Line Item","886.3","0.6","100.0","992.3","0.6","100.0","106.0","12.0","399","4"
"Arts, entertainment, and recreation","=""710000""","Summary","1,979.3","1.3","100.0","2,291.8","1.4","100.0","312.5","15.8","400","2"
"Performing arts, spectator sports, and related industries","=""711000""","Summary","381.0","0.2","100.0","508.3","0.3","100.0","127.3","33.4","401","3"
"Performing arts companies","=""711100""","Summary","81.9","0.1","100.0","110.4","0.1","100.0","28.5","34.8","402","4"
"Theater companies and dinner theaters","=""711110""","Line Item","39.0","0.0","100.0","57.8","0.0","100.0","18.7","47.9","403","5"
"Spectator sports","=""711200""","Line Item","119.4","0.1","100.0","155.9","0.1","100.0","36.5","30.5","405","4"
"Promoters of events, and agents and managers","=""7113-4""","Summary","129.6","0.1","100.0","180.4","0.1","100.0","50.8","39.2","406","4"
"Promoters of performing arts, sports, and similar events","=""711300""","Line Item","100.9","0.1","100.0","149.4","0.1","100.0","48.5","48.1","407","5"
"Agents and managers for artists, athletes, entertainers, and other public figures","=""711400""","Line Item","28.7","0.0","100.0","31.0","0.0","100.0","2.3","8.1","408","5"
"Independent artists, writers, and performers","=""711500""","Line Item","50.1","0.0","100.0","61.6","0.0","100.0","11.5","22.9","409","4"
"Museums, historical sites, and similar institutions","=""712000""","Line Item","138.8","0.1","100.0","166.4","0.1","100.0","27.6","19.9","410","3"
"Amusement, gambling, and recreation industries","=""713000""","Summary","1,459.5","0.9","100.0","1,617.1","1.0","100.0","157.6","10.8","411","3"
"Amusement parks and arcades","=""713100""","Line Item","161.3","0.1","100.0","221.8","0.1","100.0","60.5","37.5","412","4"
"Gambling industries (except casino hotels)","=""713200""","Line Item","97.4","0.1","100.0","92.2","0.1","100.0","-5.2","-5.3","413","4"
"Other amusement and recreation industries","=""713900""","Summary","1,200.8","0.8","100.0","1,303.1","0.8","100.0","102.3","8.5","414","4"
"Fitness and recreational sports centers","=""713940""","Line Item","513.4","0.3","100.0","570.7","0.3","100.0","57.3","11.2","415","5"
"Accommodation and food services","=""720000""","Summary","12,121.5","7.7","100.0","13,732.4","8.3","100.0","1,610.9","13.3","417","2"
"Accommodation","=""721000""","Summary","1,470.6","0.9","100.0","1,804.3","1.1","100.0","333.7","22.7","418","3"
"Traveler accommodation","=""721100""","Summary","1,392.2","0.9","100.0","1,722.0","1.0","100.0","329.8","23.7","419","4"
"Casino hotels","=""721120""","Line Item","193.0","0.1","100.0","267.8","0.2","100.0","74.8","38.7","420","5"
"RV (recreational vehicle) parks and recreational camps","=""721200""","Line Item","68.9","0.0","100.0","71.3","0.0","100.0","2.4","3.4","422","4"
"Rooming and boarding houses, dormitories, and workers' camps","=""721300""","Line Item","9.5","0.0","100.0","11.0","0.0","100.0","1.5","16.0","423","4"
"Food services and drinking places","=""722000""","Summary","10,650.9","6.7","100.0","11,928.2","7.2","100.0","1,277.3","12.0","424","3"
"Special food services","=""722300""","Line Item","506.1","0.3","100.0","564.2","0.3","100.0","58.1","11.5","425","4"
"Drinking places (alcoholic beverages)","=""722400""","Line Item","326.0","0.2","100.0","378.1","0.2","100.0","52.1","16.0","426","4"
"Restaurants and other eating places","=""722500""","Summary","9,818.8","6.2","100.0","10,985.9","6.6","100.0","1,167.1","11.9","427","4"
"Full-service restaurants","=""722511""","Line Item","4,598.3","2.9","100.0","5,403.5","3.2","100.0","805.2","17.5","428","5"
"Other services (except public administration)","=""810000""","Summary","6,114.2","3.9","100.0","6,641.4","4.0","100.0","527.2","8.6","430","2"
"Repair and maintenance","=""811000""","Summary","1,349.6","0.9","100.0","1,404.9","0.8","100.0","55.3","4.1","431","3"
"Automotive repair and maintenance","=""811100""","Summary","945.0","0.6","100.0","974.3","0.6","100.0","29.3","3.1","432","4"
"Automotive mechanical and electrical repair and maintenance","=""811110""","Line Item","406.8","0.3","100.0","416.0","0.2","100.0","9.2","2.3","433","5"
"Automotive body, paint, interior, and glass repair","=""811120""","Line Item","273.5","0.2","100.0","284.0","0.2","100.0","10.5","3.8","434","5"
"Other automotive repair and maintenance","=""811190""","Line Item","264.7","0.2","100.0","274.3","0.2","100.0","9.6","3.6","435","5"
"Electronic and precision equipment repair and maintenance","=""811200""","Line Item","106.2","0.1","100.0","110.4","0.1","100.0","4.2","3.9","436","4"
"Commercial and industrial machinery and equipment (except automotive and electronic) repair and maintenance","=""811300""","Line Item","217.9","0.1","100.0","236.0","0.1","100.0","18.1","8.3","437","4"
"Personal and household goods repair and maintenance","=""811400""","Line Item","80.5","0.1","100.0","84.2","0.1","100.0","3.7","4.6","438","4"
"Personal and laundry services","=""812000""","Summary","1,354.6","0.9","100.0","1,583.6","1.0","100.0","229.0","16.9","439","3"
"Personal care services","=""812100""","Line Item","671.8","0.4","100.0","791.9","0.5","100.0","120.1","17.9","440","4"
"Death care services","=""812200""","Line Item","134.0","0.1","100.0","140.2","0.1","100.0","6.2","4.6","441","4"
"Drycleaning and laundry services","=""812300""","Line Item","235.1","0.1","100.0","250.6","0.2","100.0","15.5","6.6","442","4"
"Other personal services","=""812900""","Line Item","313.7","0.2","100.0","400.9","0.2","100.0","87.2","27.8","443","4"
"Religious, grantmaking, civic, professional, and similar organizations","=""813000""","Summary","2,751.5","1.7","100.0","2,886.8","1.7","100.0","135.3","4.9","444","3"
"Grantmaking and giving services and social advocacy organizations","=""8132-3""","Summary","425.4","0.3","100.0","456.1","0.3","100.0","30.7","7.2","446","4"
"Grantmaking and giving services","=""813200""","Line Item","181.1","0.1","100.0","192.7","0.1","100.0","11.6","6.4","447","5"
"Social advocacy organizations","=""813300""","Line Item","244.3","0.2","100.0","263.4","0.2","100.0","19.1","7.8","448","5"
"Civic, social, professional, and similar organizations","=""8134-9""","Summary","725.3","0.5","100.0","816.9","0.5","100.0","91.6","12.6","449","4"
"Civic and social organizations","=""813400""","Line Item","279.0","0.2","100.0","368.7","0.2","100.0","89.7","32.1","450","5"
"Business, professional, labor, political, and similar organizations","=""813900""","Summary","446.3","0.3","100.0","448.2","0.3","100.0","1.9","0.4","451","5"
"Labor unions and similar labor organizations","=""813930""","Line Item","99.7","0.1","100.0","96.0","0.1","100.0","-3.7","-3.7","452","6"
"Private households","=""814000""","Line Item","658.5","0.4","100.0","766.1","0.5","100.0","107.6","16.3","454","3"
"Government","=""900000""","Summary","10,802.0","6.8","100.0","10,639.6","6.4","100.0","-162.4","-1.5","455","2"
"Federal government","=""910000""","Summary","2,885.7","1.8","100.0","2,780.7","1.7","100.0","-105.0","-3.6","456","3"
"Postal service","=""491000""","Line Item","606.0","0.4","100.0","571.0","0.3","100.0","-35.0","-5.8","457","4"
"Federal government, excluding postal service","=""999100""","Line Item","2,279.7","1.4","100.0","2,209.6","1.3","100.0","-70.1","-3.1","458","4"
"State government, excluding education and hospitals","=""999200""","Line Item","2,264.8","1.4","100.0","2,129.8","1.3","100.0","-135.0","-6.0","459","3"
"Local government, excluding education and hospitals","=""999300""","Line Item","5,651.5","3.6","100.0","5,729.2","3.4","100.0","77.7","1.4","460","3"
